{
  "schema": "frame-graph-capture-v1",
  "schema_version": 1,
  "summary": {
    "recorded_node_count": 0,
    "retained_node_count": 0,
    "culled_node_count": 0,
    "resource_count": 0,
    "view_count": 0,
    "access_count": 0,
    "value_count": 0,
    "dependency_count": 0,
    "allocation_count": 0,
    "logical_transient_bytes": 0,
    "physical_allocation_bytes": 0,
    "timings": {
      "validation_ns": 0,
      "dependency_ns": 0,
      "retention_ns": 0,
      "planning_ns": 0,
      "report_ns": 0,
      "total_ns": 0
    }
  },
  "graph": {
    "nodes": [],
    "culled_nodes": [],
    "resources": [],
    "views": [],
    "accesses": [],
    "values": [],
    "dependencies": [],
    "roots": [],
    "allocations": [],
    "execution_segments": [],
    "diagnostics": []
  }
}

